{
  "schemaVersion": 1,
  "entityType": "product",
  "id": "44444444-4444-4444-8444-444444444444",
  "typeTermKey": "medication",
  "classificationTermKeys": [],
  "applicableTaxonIds": ["canis-lupus-familiaris"],
  "regions": [],
  "manufacturerId": "11111111-1111-4111-8111-111111111111",
  "activeIngredientIds": [],
  "regulatoryIdentifiers": { "brazilMapa": null, "unitedStatesNada": null, "unitedStatesAnada": null, "gtinEan": null },
  "applicableLifeStages": ["newborn", "young", "adult"],
  "therapeuticSpectrum": "broad",
  "localizedContent": {
    "name": { "pt-BR": "Fixture broad", "pt-PT": "Fixture broad", "gn-PY": "Fixture broad", "en-US": "Fixture broad", "es-ES": "Fixture broad", "fr-FR": "Fixture broad" },
    "aliases": { "pt-BR": [], "pt-PT": [], "gn-PY": [], "en-US": [], "es-ES": [], "fr-FR": [] }
  },
  "sections": []
}
